{
  "schema_version": "A16E",
  "mission_id": "A16X_INFRA_DRIFT",
  "mission_type": "AUTOMATION_EFFICIENCY",
  "friction_targeted": [],
  "friction_reduced": [],
  "friction_created": ["F8"],
  "potential_unlock_loop_steps": [],
  "potential_acceleration_score": {
    "real_game_leverage": 0,
    "active_effort": 0,
    "feedback_quality": 1,
    "transfer_probability": 0,
    "personalization": 0,
    "engagement_loop": 0,
    "truthfulness": 2,
    "total": 3
  },
  "unlock_value": "infra_only",
  "revolutionary_value_verdict": "NO",
  "fake_progress_risk": "medium",
  "why_this_matters": "It only makes automation more elaborate.",
  "evidence": [],
  "recommended_next_action": "STRATEGIC_PULSE"
}
